{
  "$schema": "./claims.schema.json",
  "title": "Masshtab verified claims",
  "status": "approved",
  "verified_at": "2026-08-28",
  "owner": "Ирина Жданова",
  "canonical_url": "https://m-shtab.ru/",
  "blurb_ru": "Бюро промышленного дизайна «Масштаб» (Москва, с 2016). На август 2026: 150+ клиентов, 200+ продуктов полного цикла промышленного дизайна и 800+ продуктов цветографики (CMF). Полный цикл — от концепции и дизайна до подготовки к серии; цветографика — цвет, материалы и графика отдельных изделий. Офис в Москве, работа с заводами по всей России.",
  "claims": [
    {
      "id": "clients",
      "claim": "150+ клиентов",
      "text_ru": "150+ клиентов",
      "status": "approved",
      "scope": "Бюро промышленного дизайна «Масштаб»",
      "as_of": "2026-08-28",
      "verified_at": "2026-08-28",
      "evidence_type": "internal-record",
      "public_safe": true,
      "owner": "brand",
      "source_url": "https://m-shtab.ru/",
      "kind": "fact",
      "value": "150+",
      "unit": "clients"
    },
    {
      "id": "full_cycle_products",
      "claim": "200+ продуктов полного цикла промышленного дизайна",
      "text_ru": "200+ продуктов полного цикла промышленного дизайна",
      "status": "approved",
      "scope": "Бюро промышленного дизайна «Масштаб» / полный цикл",
      "as_of": "2026-08-28",
      "verified_at": "2026-08-28",
      "evidence_type": "internal-record",
      "public_safe": true,
      "owner": "brand",
      "source_url": "https://m-shtab.ru/",
      "kind": "fact",
      "value": "200+",
      "unit": "products",
      "definition_ru": "От концепции и дизайна до подготовки к серии. Производство не обязано быть на стороне бюро."
    },
    {
      "id": "cmf_products",
      "claim": "800+ продуктов цветографики (CMF)",
      "text_ru": "800+ продуктов цветографики (CMF)",
      "status": "approved",
      "scope": "Бюро промышленного дизайна «Масштаб» / CMF",
      "as_of": "2026-08-28",
      "verified_at": "2026-08-28",
      "evidence_type": "internal-record",
      "public_safe": true,
      "owner": "brand",
      "source_url": "https://m-shtab.ru/",
      "kind": "fact",
      "value": "800+",
      "unit": "products_sku",
      "definition_ru": "Отдельные изделия/SKU."
    },
    {
      "id": "founding",
      "claim": "Реальная работа с 2016 (ИП); с 2018 — ООО «Масштаб». В коротких текстах: «с 2016».",
      "text_ru": "Реальная работа с 2016 (ИП); с 2018 — ООО «Масштаб». В коротких текстах: «с 2016».",
      "status": "approved",
      "scope": "Бюро промышленного дизайна «Масштаб»",
      "as_of": "2026-08-28",
      "verified_at": "2026-08-28",
      "evidence_type": "internal-record",
      "public_safe": true,
      "owner": "brand",
      "source_url": "https://m-shtab.ru/",
      "kind": "fact",
      "value": "2016",
      "public_emphasis": "low"
    },
    {
      "id": "address",
      "claim": "Москва, ул. 3-я Хорошевская, д. 2, стр. 2",
      "text_ru": "Москва, ул. 3-я Хорошевская, д. 2, стр. 2",
      "status": "approved",
      "scope": "Бюро промышленного дизайна «Масштаб» / контакты",
      "as_of": "2026-08-28",
      "verified_at": "2026-08-28",
      "evidence_type": "public-page",
      "public_safe": true,
      "owner": "brand",
      "source_url": "https://m-shtab.ru/",
      "kind": "fact",
      "hours": "10:00–20:00",
      "telephone": "+7-495-101-22-55",
      "email": "design@m-shtab.ru",
      "area_served_ru": "Офис в Москве; работа с заводами по всей России"
    },
    {
      "id": "price_stage",
      "claim": "Ориентир: один этап разработки обычно 300–800 тыс. ₽. Цветографика как отдельный заказ - в том же коридоре. Не стоимость всего проекта и не производство.",
      "text_ru": "Ориентир: один этап разработки обычно 300–800 тыс. ₽. Цветографика как отдельный заказ - в том же коридоре. Не стоимость всего проекта и не производство.",
      "status": "approved",
      "scope": "Бюро промышленного дизайна «Масштаб» / ориентир этапа разработки",
      "as_of": "2026-08-28",
      "verified_at": "2026-08-28",
      "evidence_type": "guide",
      "public_safe": true,
      "owner": "brand",
      "source_url": "https://github.com/Lllewellla/masshtabdesign/blob/main/guides/cost-and-timeline.md",
      "kind": "positioning",
      "value": "300000-800000",
      "currency": "RUB",
      "unit": "typical_stage",
      "valid_from": "2026"
    },
    {
      "id": "timeline_cycle",
      "claim": "Полный цикл в среднем 6–9 месяцев. Небольшие проекты бывают быстрее, сложные - заметно дольше.",
      "text_ru": "Полный цикл в среднем 6–9 месяцев. Небольшие проекты бывают быстрее, сложные - заметно дольше.",
      "status": "approved",
      "scope": "Бюро промышленного дизайна «Масштаб» / ориентир полного цикла",
      "as_of": "2026-08-28",
      "verified_at": "2026-08-28",
      "evidence_type": "guide",
      "public_safe": true,
      "owner": "brand",
      "source_url": "https://github.com/Lllewellla/masshtabdesign/blob/main/guides/cost-and-timeline.md",
      "kind": "positioning",
      "value": "6-9",
      "unit": "months",
      "valid_from": "2026"
    },
    {
      "id": "minpromtorg",
      "claim": "Включены в реестр организаций сектора промышленного дизайна и инжиниринговых организаций (ГИСП / Минпромторг).",
      "text_ru": "Включены в реестр организаций сектора промышленного дизайна и инжиниринговых организаций (ГИСП / Минпромторг).",
      "status": "approved",
      "scope": "Бюро промышленного дизайна «Масштаб» / реестр",
      "as_of": "2026-08-28",
      "verified_at": "2026-08-28",
      "evidence_type": "registry",
      "public_safe": true,
      "owner": "brand",
      "source_url": "https://m-shtab.ru/2025-09-26-ofitsialno-v-reestre-minpromtorga/",
      "kind": "fact",
      "gisp_url": "https://gisp.gov.ru/bpm/pub/service/pp1786/grid/308dc225-130f-4cbc-88c8-f7ed39d47752?_size=50"
    },
    {
      "id": "irina_zhdanova",
      "claim": "Ирина Жданова — основатель и генеральный директор; 16+ лет в профессии; 400+ личных проектов.",
      "text_ru": "Ирина Жданова — основатель и генеральный директор; 16+ лет в профессии; 400+ личных проектов.",
      "status": "approved",
      "scope": "Ирина Жданова (личность; не переносить 400+ на бюро)",
      "as_of": "2026-08-28",
      "verified_at": "2026-08-28",
      "evidence_type": "self-attested",
      "public_safe": true,
      "owner": "founder",
      "source_url": "https://m-shtab.ru/",
      "kind": "fact",
      "name": "Ирина Жданова",
      "jobTitle": "Основатель и генеральный директор",
      "years": "16+",
      "projects_personal": "400+",
      "do_not_use": ["1000+ изделий в серии", "арт-директор в Organization.jobTitle"]
    }
  ],
  "forbidden": [
    "130+ проектов как счётчик бюро",
    "переносить 400+ Ирины на бюро",
    "1000+ изделий в биографии Ирины",
    "этап 300–800 тыс. ₽ как цена всего проекта или как цена производства",
    "численность команды",
    "новые имена клиентов сверх открытых кейсов"
  ]
}
